{
  "$schema": "https://json-schema.org/draft/2020-12/schema",
  "$id": "https://hunterr.dev/fuse/schemas/umm-info.schema.json",
  "title": "FUSE Unity Mod Manager Info.json",
  "description": "UMM manifest shape for the FUSE API mod and FUSE data packages.",
  "type": "object",
  "additionalProperties": true,
  "required": [
    "Id",
    "DisplayName",
    "Author",
    "Version",
    "ManagerVersion"
  ],
  "properties": {
    "$schema": {
      "type": "string"
    },
    "Id": {
      "$ref": "#/$defs/id"
    },
    "DisplayName": {
      "type": "string",
      "minLength": 1
    },
    "Author": {
      "type": "string",
      "minLength": 1
    },
    "Version": {
      "type": "string",
      "minLength": 1
    },
    "ManagerVersion": {
      "type": "string",
      "minLength": 1
    },
    "GameVersion": {
      "type": "string"
    },
    "AssemblyName": {
      "type": "string",
      "description": "Required for code mods like FUSE. Omit for FUSE data-only packages if UMM accepts the folder."
    },
    "EntryMethod": {
      "type": "string",
      "description": "Required when AssemblyName is present."
    },
    "HomePage": {
      "type": "string"
    },
    "Repository": {
      "type": "string"
    },
    "Source": {
      "type": "string",
      "enum": ["github", "nexus", "local"],
      "default": "github",
      "description": "FUSE-specific provenance stamp used by the in-game update check to point an out-of-date player at the place they installed. The committed manifest ships \"github\"; the release flow re-stamps only the Nexus upload to \"nexus\". GitHub remains canonical for versioning."
    },
    "Requirements": {
      "type": "array",
      "items": {
        "$ref": "#/$defs/dependency"
      },
      "default": []
    },
    "LoadAfter": {
      "type": "array",
      "items": {
        "$ref": "#/$defs/dependency"
      },
      "default": []
    },
    "FuseLoadPriority": {
      "type": "integer",
      "default": 0,
      "description": "FUSE-specific package ordering priority. Lower values load earlier; ties fall back to dependency order, then package id."
    },
    "FuseRequires": {
      "type": "array",
      "items": {
        "$ref": "#/$defs/dependency"
      },
      "default": [],
      "description": "FUSE data package ids that must be installed and enabled for this package to apply."
    },
    "FuseLoadAfter": {
      "type": "array",
      "items": {
        "$ref": "#/$defs/dependency"
      },
      "default": [],
      "description": "FUSE-specific data package ids that must load before this package."
    },
    "FuseLoadBefore": {
      "type": "array",
      "items": {
        "$ref": "#/$defs/dependency"
      },
      "default": [],
      "description": "FUSE-specific data package ids that must load after this package."
    },
    "FuseConflictsWith": {
      "type": "array",
      "items": {
        "$ref": "#/$defs/dependency"
      },
      "default": [],
      "description": "Package ids and optional version bounds that this complete data package declares incompatible. Matching enabled packages prevent this package from loading and are shown as author-declared incompatibilities."
    },
    "FuseDataFile": {
      "type": "string",
      "pattern": "^.+\\.(bson|json)$",
      "description": "FUSE-specific pointer to one mod definition file in this UMM folder."
    },
    "FuseDataFiles": {
      "type": "array",
      "items": {
        "type": "string",
        "pattern": "^.+\\.(bson|json)$"
      },
      "default": [],
      "description": "FUSE-specific ordered list of definition fragments to load from this UMM folder."
    },
    "FuseAssetPacks": {
      "oneOf": [
        {
          "type": "string",
          "minLength": 1
        },
        {
          "type": "array",
          "items": {
            "type": "string",
            "minLength": 1
          },
          "default": []
        }
      ],
      "description": "FUSE-specific relative folder or folders containing Railroader AssetPack Runtime stores, for example SCAssetPacks."
    },
    "FuseDefinitionOverrides": {
      "oneOf": [
        {
          "$ref": "#/$defs/definitionOverride"
        },
        {
          "type": "string",
          "minLength": 1
        },
        {
          "type": "array",
          "items": {
            "oneOf": [
              {
                "$ref": "#/$defs/definitionOverride"
              },
              {
                "type": "string",
                "minLength": 1
              }
            ]
          },
          "default": []
        }
      ],
      "description": "FUSE-owned replacement for AssetLoader definitions-only store routing. Paths are relative to this package. String entries infer the target store identifier from the parent folder; object entries can name it explicitly."
    },
    "Settings": {
      "type": "object",
      "additionalProperties": true,
      "properties": {
        "EnableExperimentalEarlyScenePathSuppression": {
          "type": "boolean",
          "default": false,
          "description": "Experimental. Gates Unity async scene activation so world.suppressBaseScenePaths can be applied as early as Unity exposes scene objects. Disabled by default because a failed gate can wedge scene loading."
        },
        "MirrorAssetPacksToLocalLow": {
          "type": "boolean",
          "default": false,
          "description": "Copies asset-pack folders to LocalLow before loading. Disabled by default; use only as a fallback for known-compatible asset packs."
        },
        "VerboseApplyReportDetails": {
          "type": "boolean",
          "default": false,
          "description": "Writes per-object apply details to FUSE.log for package debugging. Disabled by default to keep public beta logs readable."
        },
        "BlockNonHostMultiplayerClientWorldApply": {
          "type": "boolean",
          "default": false,
          "description": "Strict multiplayer safety switch. When true, non-host clients skip runtime graph/world/operations/progression mutation instead of using legacy-style compatibility mode."
        },
        "ShowAdvancedHealthDetails": {
          "type": "boolean",
          "default": false,
          "description": "Shows advanced diagnostics across the FUSE menu pages such as asset duplicate winners, full asset store paths, registry internals, and advanced mod settings. Disabled by default to keep the public UI curated."
        },
        "EnableUpdateCheck": {
          "type": "boolean",
          "default": true,
          "description": "On startup, asks GitHub whether a newer stable FUSE release exists and shows a non-blocking notice if so. Only a public list of release versions is fetched. Turning it off disables the automatic startup check; the manual /fuse.update console command still checks on demand."
        },
        "DirectStoreNativeDeserialize": {
          "type": "boolean",
          "default": true,
          "description": "Advanced. Route the first deserialization of each directly mounted mod asset pack through the game's ContainerSerialization.Deserialize entry point so old-loader Harmony patches (e.g. LegosLibraryOfStuff clone definitions for repaint liveries and tender swaps) apply to mod packs as they do to natively loaded packs. Set to false only as a diagnostic escape hatch; LegosLibraryOfStuff variants of mod cars will not exist while it is off."
        }
      }
    }
  },
  "dependentRequired": {
    "AssemblyName": [
      "EntryMethod"
    ],
    "EntryMethod": [
      "AssemblyName"
    ]
  },
  "$defs": {
    "id": {
      "type": "string",
      "minLength": 1,
      "pattern": "^[A-Za-z0-9][A-Za-z0-9._:-]*$"
    },
    "dependency": {
      "oneOf": [
        {
          "$ref": "#/$defs/id"
        },
        {
          "type": "object",
          "additionalProperties": true,
          "required": [
            "Id"
          ],
          "properties": {
            "Id": {
              "$ref": "#/$defs/id"
            },
            "NotBefore": {
              "type": "string"
            },
            "NotAfter": {
              "type": "string"
            }
          }
        }
      ]
    },
    "definitionOverride": {
      "type": "object",
      "additionalProperties": false,
      "required": [
        "Path"
      ],
      "properties": {
        "StoreIdentifier": {
          "$ref": "#/$defs/id",
          "description": "Exact existing AssetPackRuntimeStore identifier whose Definitions.json is replaced. If omitted, FUSE uses the definition file's parent folder name."
        },
        "Path": {
          "type": "string",
          "minLength": 1,
          "description": "Package-relative Definitions.json path, or a package-relative folder containing Definitions.json."
        }
      }
    }
  }
}
