{
  "Id": "FUSE",
  "DisplayName": "FUSE",
  "Author": "Hunter Rogers",
  "Version": "0.0.0",
  "ManagerVersion": "0.27.10",
  "GameVersion": "2025.1",
  "AssemblyName": "FUSE.dll",
  "EntryMethod": "FUSE.FusePlugin.Load",
  "HomePage": "",
  "Source": "github",
  "Settings": {
    "EnableExperimentalEarlyScenePathSuppression": false,
    "MirrorAssetPacksToLocalLow": false,
    "VerboseApplyReportDetails": false,
    "EnableSceneryCullingDiagnostics": false,
    "BlockNonHostMultiplayerClientWorldApply": false,
    "ShowAdvancedHealthDetails": false,
    "ShowLegacyModsInUmm": false,
    "EnableEnhancedLoadingScreen": true,
    "DecoupleVisualConditionLimits": false,
    "EnableFrameSpikeDiagnostics": false,
    "FrameSpikeThresholdMs": 100,
    "ForceConstrainedVramMode": false,
    "EnableNativeLeakStackTraces": false,
    "EnableUpdateCheck": true,
    "GraceMinimumDays": 0,
    "GraceMultiplier": 1,
    "GraceAddedDays": 0,
    "InterchangeServiceIntervalMinutes": 150,
    "InterchangeContinuousService": false,
    "InterchangeNotBeforeHour": 0,
    "InterchangeNotAfterHour": 24,
    "EnableOutboundIndustryRerouting": false,
    "OutboundIndustryRerouteChance": 0.25,
    "OutboundIndustryFillFactor": 1,
    "OutboundIndustryPaymentMultiplier": 1,
    "OutboundIndustryAllowShortTrips": false,
    "OutboundIndustryIgnoreOrigin": false,
    "OutboundIndustryPreventBlocking": false,
    "InterchangeToInterchangeMaximumCars": 30,
    "ForYourConvenienceShowCabooseIcons": false,
    "ForYourConvenienceShowCarTagMph": false,
    "ForYourConvenienceShowCarTagLoads": false
  }
}
